PassengerId,Survived,Pclass,Name,Sex,Age,SibSp,Parch,Fare,Cabin,Embarked,Title,FamilySize,HasCabin,AgeGroup
1,0,3,"Braund, Mr. Owen Harris",male,22,1,0,7.25,,S,Mr,2,0,adult
2,1,1,"Cumings, Mrs. John Bradley (Florence Briggs Thayer)",female,38,1,0,71.2833,C85,C,Mrs,2,1,middle_age
3,1,3,"Heikkinen, Miss. Laina",female,26,0,0,7.925,,S,Miss,1,0,adult
4,1,1,"Futrelle, Mrs. Jacques Heath (Lily May Peel)",female,35,1,0,53.1,C123,S,Mrs,2,1,middle_age
5,0,3,"Allen, Mr. William Henry",male,35,0,0,8.05,,S,Mr,1,0,middle_age
